<?xml version="1.0" encoding="UTF-8"?>
<xs:schema attributeFormDefault="unqualified" elementFormDefault="qualified" xmlns:xs="http://www.w3.org/2001/XMLSchema">
  <xs:element name="Refs">
    <xs:complexType>
      <xs:sequence>
        <xs:element name="Authentication">
          <xs:complexType>
            <xs:sequence>
              <xs:element name="Site" maxOccurs="unbounded" minOccurs="0">
                <xs:complexType>
                  <xs:sequence>
                    <xs:element type="xs:string" name="Name"/>
                    <xs:element type="xs:string" name="Login"/>
                    <xs:element type="xs:string" name="Password"/>
                  </xs:sequence>
                  <xs:attribute type="xs:byte" name="id" use="optional"/>
                </xs:complexType>
              </xs:element>
            </xs:sequence>
          </xs:complexType>
        </xs:element>
      </xs:sequence>
    </xs:complexType>
  </xs:element>
</xs:schema>